Title,Takeaway,Authors,Year,Citations,Abstract,Study Type,Journal,Journal SJR Quartile,DOI,Consensus Link
"A Systematic Review of Implementing Multi-Criteria Decision-Making (MCDM) Approaches for the Circular Economy and Cost Assessment","Multi-Criteria Decision-Making (MCDM) is a valuable tool for evaluating the circular economy, balancing environmental, economic, and social criteria.","Ali Tighnavard Balasbaneh, Silvio Aldrovandi, Willy Sher",2025,41,"This study advances circular economy initiatives by advocating for the use of Multi-Criteria Decision-Making (MCDM). MCDM methods address the complex multi-faceted aspects of a product or process. They enable conflicting calculations of energy, cost, environmental criteria, and payback periods to be balanced. A systematic critical systematic review and bibliometric analysis were conducted to investigate the contribution of MCDM to the circular economy. The Scopus database was the primary data source reviewed. The geographical distribution, main research sources, and keyword co-occurrences were analyzed across 31 peer-reviewed book chapters, conference papers, and journal articles. The journal Sustainability (Switzerland) had the most publications (4), followed by the Journal of Business Strategy and the Environment and the Journal of Cleaner Production, each with two articles. Recently MCDM has gained popularity as a tool for evaluating the circular economy. This growing interest may be attributed to the complexity of the circular economy, as MCDM effectively balances multiple environmental criteria while integrating evaluations of economic cost and social impact. Criteria are incommensurable as each criterion has a distinct unit of measurement, making it impossible to compare outcomes across different indicators. MCDM is thus an ideal technique for assessing different options by integrating criteria within testable frameworks. However, no established patterns for selecting specific MCDM methods were identified. This is despite some options (e.g., combinations of AHP and TOPSIS) being used more frequently than others. In conclusion, all the studies identified financial factors as the most significant or highly sensitive issue in the transition toward a circular economy.","systematic review","Sustainability","1","10.3390/su17115007","https://consensus.app/papers/a-systematic-review-of-implementing-multicriteria-balasbaneh-aldrovandi/d34c0bc9e6a65a0db986af933af9d9c6/"
"Workplace Spirituality and Its Impact on Employee Well-Being: A Systematic Literature Review of Global Evidence","Religious workplace practices positively correlate with employee well-being, but organizations must balance religious expression with inclusivity to foster a supportive and harmonious work environment.","Aminun Nabil Ahmad Syahir, Mohd Syukri Zainal Abidin, C. Z. Sa’ari, Muhamad Zulfadli Abdul Rahman",2025,31,"Employee well-being is a critical factor influencing organizational performance, job satisfaction, and overall productivity. The role of religión in the workplace in shaping employee well-being has gained increasing scholarly attention, yet a comprehensive synthesis of existing literature remains limited. Further the lack of a comprehensive synthesis makes it difficult to assess the overall impact of religious environments on employees' psychological and professional experiences. This systematic literature review examines the impact of religious workplace environments on employee well-being from global evidence by analyzing 38 relevant studies retrieved from the Scopus and Web of Science databases. The review follows the PRISMA guidelines to ensure a rigorous selection and evaluation process focusing on studies published between 2020 and 2024. The findings were divided into four themes, namely: workplace spirituality and employee well-being, spiritual leadership and organizational performance, workplace spirituality and employee engagement or motivation, and religiosity, spirituality, and employee experiences. The results indicate that a majority of the studies demonstrate a positive correlation between religious workplace practices and employee well-being metrics, reinforcing the significance of organizational spirituality. Despite these benefits, the review underscores the importance of inclusive workplace policies to ensure that religious expression does not lead to alienation or conflict. The study concludes that while religious workplaces can significantly enhance employee well-being, organizations must balance religious expressions with inclusivity to foster a supportive and harmonious work environment. Future research should explore cross-cultural comparisons and longitudinal studies to better understand the long-term implications of religious workplace settings on employee well-being.

© 2025. The Author(s).","systematic review","Journal of Religion and Health","1","10.1007/s10943-025-02350-2","https://consensus.app/papers/workplace-spirituality-and-its-impact-on-employee-syahir-abidin/8d33c1048c7256b8a5c212cefd3333fd/"
"Resilience in the Workplace: A Multilevel Review and Synthesis","Resilience in the workplace is crucial for employees to handle adversity and positively influence organizational outcomes, but its conceptualization, development, and influence remain in debate.","Silja Hartmann, M. Weiss, Alexander Newman, M. Hoegl",2019,412,"In an increasingly dynamic business environment, the concept of resilience is fundamental to understanding how employees successfully handle adversity. Yet, the operationalisation of the concept, the factors which lead to its development, and how and why it influences outcomes of interest to organisations are issues still under debate in the literature. In this article, we address these debates by undertaking a critical review of research on resilience in the workplace at both the individual and team levels. We pinpoint different conceptualisations of resilience and highlight how resilience has been measured in extant quantitative work. Further, we provide a systematic literature review of empirical work on the antecedents and outcomes of resilience at the individual and team levels, as well as conduct a review of work that has introduced resilience as a moderator or mediator. In doing so, we highlight theoretical approaches that have been adopted to study resilience in the workplace. Based on our review of the extant empirical work on resilience, we develop a roadmap for future research. In particular, we pinpoint relevant theoretical approaches that help us understand the mechanisms underlying the development and outcomes of resilience and highlight opportunities for empirical advancement of the literature.","systematic review","Applied Psychology","1","10.1111/apps.12191","https://consensus.app/papers/resilience-in-the-workplace-a-multilevel-review-and-hartmann-weiss/a69abaf7a5f058b18048974df5892989/"
"Enhancing employees’ performance and well-being with nature exposure embedded office workplace design","Workplace design that integrates both indoor and outdoor nature exposure improves employee well-being and performance, contributing to integrated sustainability.","Abdul-Manan Sadick, Imriyas Kamardeen",2020,89,"","systematic review","Journal of building engineering","1","10.1016/j.jobe.2020.101789","https://consensus.app/papers/enhancing-employees-performance-and-wellbeing-with-sadick-kamardeen/43b5ae61a6545e399cc1b454975596c7/"
"FinMem: A Performance-Enhanced LLM Trading Agent With Layered Memory and Character Design","FinMem, a LLM-based trading agent, outperforms advanced algorithms in real-world financial trading by utilizing layered memory and character design for efficient data assimilation and decision-making.","Yangyang Yu, Haohang Li, Zhi Chen, Yuechen Jiang, Yang Li, Jordan W. Suchow, Denghui Zhang, K. Khashanah",2023,195,"We introduce FinMem, a novel Large Language Models (LLM)-based agent framework for financial trading, designed to address the need for automated systems that can transform real-time data into executable decisions. FinMem comprises three core modules: Profile for customizing agent characteristics, Memory for hierarchical financial data assimilation, and Decision-making for converting insights into investment choices. The Memory module, which mimics human traders’ cognitive structure, offers interpretability and real-time tuning while handling the critical timing of various information types. It employs a layered approach to process and prioritize data based on its timeliness and relevance, ensuring that the most recent and impactful information is given appropriate weight in decision-making. FinMem’s adjustable cognitive span allows retention of critical information beyond human limits, enabling it to balance historical patterns with current market dynamics. This framework facilitates self-evolution of professional knowledge, agile reactions to investment cues, and continuous refinement of trading decisions in financial environments. When compared against advanced algorithmic agents using a large-scale real-world financial dataset, FinMem demonstrates superior performance across classic metrics like Cumulative Return and Sharpe ratio. Further tuning of the agent’s perceptual span and character setting enhances its trading performance, positioning FinMem as a cutting-edge solution for automated trading.","theoretical, modeling, or simulation study","IEEE Transactions on Big Data","1","10.1109/tbdata.2025.3593370","https://consensus.app/papers/finmem-a-performanceenhanced-llm-trading-agent-with-yu-li/5651cdce424e54bea80bc7f0e5469351/"
